{
  "schema_version": 1,
  "id": "crown_of_valor",
  "name": {
    "en": "Crown of Valor"
  },
  "bonuses": [
    {
      "pieces": 3,
      "text": "Upon gaining a Shield, increase the Resonator's ATK by 6% and Crit. DMG by 4% for 4s. This effect can be triggered once every 0.5s and stacks up to 5 times."
    }
  ],
  "icon": "echo_sets/crown_of_valor/icon.png",
  "source": {
    "site": "Wuthering Waves Wiki",
    "page_url": "https://wutheringwaves.fandom.com/wiki/Crown_of_Valor",
    "verified_at": "2026-10-02",
    "revision_id": 85692
  }
}
