{
  "schema_version": 1,
  "id": "law_of_harmony",
  "name": {
    "en": "Law of Harmony"
  },
  "bonuses": [
    {
      "pieces": 3,
      "text": "Casting Echo Skill grants 30% Heavy Attack DMG Bonus to the caster for 4s. Additionally, all Resonators in the team gain 4% Echo Skill DMG Bonus for 30s, stacking up to 4 times. Echoes of the same name can only trigger this effect once. The record of Echo triggering this effect is cleared along with this effect. At 4 stacks, casting Echo Skill again resets the duration of this effect."
    }
  ],
  "icon": "echo_sets/law_of_harmony/icon.png",
  "source": {
    "site": "Wuthering Waves Wiki",
    "page_url": "https://wutheringwaves.fandom.com/wiki/Law_of_Harmony",
    "verified_at": "2026-10-02",
    "revision_id": 85691
  }
}
