{
  "schema_version": 1,
  "id": "gusts_of_welkin",
  "name": {
    "en": "Gusts of Welkin"
  },
  "bonuses": [
    {
      "pieces": 2,
      "text": "Aero DMG +10%."
    },
    {
      "pieces": 5,
      "text": "Inflicting Aero Erosion on enemies increases Aero DMG for all Resonators in the team by 15%, and for the Resonator triggering this effect by an additional 15%, lasting for 20s."
    }
  ],
  "icon": "echo_sets/gusts_of_welkin/icon.png",
  "source": {
    "site": "Wuthering Waves Wiki",
    "page_url": "https://wutheringwaves.fandom.com/wiki/Gusts_of_Welkin",
    "verified_at": "2026-10-02",
    "revision_id": 85688
  }
}
